user;waktu;Sentimen;lokasi;komentar
Betel Nur Baytie;10 bulan lalu;Positif;puncak ratu;Suasananya menyenangkan, tempatnya sejuk tapi sayang tidak seperti beberapa tahun silam. Beberapa pohon yang ada sepertinya ditebang, lebih rindang yang dulu.
M. Mufid Albarazi;10 bulan lalu;Positif;puncak ratu;Tempat yg bagus untuk healing!!!
012_Nurul Fajriyah Hidayat Putri;10 bulan lalu;Positif;puncak ratu;Destinasi wisata yang belum berkembang ini, yang dapat ditemukan di Desa Tebul Barat Kabupaten Pamekasan Jawa Timur, Kecamatan Pegantenan, dan Pegantenan, memberikan pengunjung rasa alam bebas yang segar. Daerah ini menikmati udara bers …
Aufar Fikri Dimyati;10 bulan lalu;Positif;puncak ratu;Sebenarnya masih sekitar 30-45 menit dari Pamekasan, tempat yang sangat sejuk, pema …
Rie craft;11 bulan lalu;Positif;puncak ratu;Wisata alam yg slalu berinovasi tiada henti...??
Abdul Latif;11 bulan lalu;Positif;puncak ratu;Baguss si sebenernya tapi kalo di kasih sarana permainan yg menarik pasti lebih bagus, dan pastinya lebih menarik perhatian pengunjung ?? …
Alfin dores;11 bulan lalu;Positif;puncak ratu;Hasilnya memuaskan
Nizaroh;2 bulan lalu;Negatif;puncak ratu;Gda gunanya akun official instagramnya, di dm gadibales². Dan fasilitas disana kurang memadai dari segi tenda, homecamp, kamar mandi dan tempat sampah sedikit.
Hafni Iva N;2 hari lalu;Positif;puncak ratu;Salah satu tempat wisata yang berada di Kabupaten Pamekasan Madura. Cocok ke sini kalau sore menjelang malam, pemandangannya bagus. Kalau malam ada live music ???? …
Syarif Maulana;2 tahun lalu;Positif;puncak ratu;Tempat wisata keluarga dengan pemandangan alam yang indah dan hawa yang sejuk. Banyak tempat untuk spot foto latar belakang pemandangan yang indah. Harga makanan dan minuman relatif standar.  Waktu tempuh ketempat wisata ini kurang lebih …
Lionelsi Kudo;2 tahun lalu;Positif;puncak ratu;tempat nya sih gak luas, tapi nyaman banget buat piknik. set foto2nya udah mulai banyak...saran aja, bunga warna warni nya ditambahin...pasti makin kerennnnnn
Nurdin Rizqiansyah;2 tahun lalu;Positif;puncak ratu;"Tempat wisata yang bagus...
Tidak terlalu jauh dr pusat kota pamekasan...
Akses jalannya udah baik... …"
Lingga Kurniawan;2 tahun lalu;Positif;puncak ratu;"tempatnya baguus...
namuun perlu lebih ditambahi fasilitaas"" dan diperbaiki fasilitas yg sdh rusak
kalo ke puncak ratu bagus di saat senja.
bisa menikmati matahari terbenam ?????? …"
Qur'Aini Meliana;2 tahun lalu;Positif;puncak ratu;"Tempat nya enak, dingin, udara nya sejuk
Cocok untuk camping disini, atau ingin sekedar menghabiskan waktu dg keluarga
Karena tempat nya nyaman untuk melepaskan penat"
cherry;2 tahun lalu;Positif;puncak ratu;The view was unexpectedly amazing. Cocok  buat merenung (?) dan piknik juga mgkin. Lokasinya jauh dari kota, agak pegel juga kalo motoran. Lumayan buat tempat foto.
anbazt 86;2 tahun lalu;Positif;puncak ratu;Tempat bagus suasana pegunungan yg sejuk dan  tempat spot foto yg menarik cuman kantin aj yg makanannya kurang lengkap......
Mia Nurhajah;2 tahun lalu;Positif;puncak ratu;Tempatnya estetic banget.. Cocok untuk yang suka selfie2, pemandangannya luar biasa indah masyaAllah, bawaannya senang disana..
Dika Oktavian Prasetya;2 tahun lalu;Positif;puncak ratu;Tempatnya sebenarnya sejuk, bagus, banyak pohon dan spot yg 'instagramable', namun sayang sekali pas kesana kemaren banyak sampah di spot - spot tadi. Pengunjungnya harus di edukasi lbh baik lagi. Utk pengelola mungkin bisa ditambahi lampu penerangan lagi
Anaaa;2 tahun lalu;Positif;puncak ratu;Pas kemarin kesini pagi² banget alhamdulillah masih sepi jadinya bisa puas fotonya?? …
Alfarisi Waris;2 tahun lalu;Positif;puncak ratu;"Bagus sih.... Tapi kayak kurang terawat...
Dan Ndak da yang jualan... Mungkin karena bukan weekend"
Arif C. Permana;2 tahun lalu;Positif;puncak ratu;Tempat spot foto yg indah...dgn pohon2 yg tinggi menjulang sehingga membuat suasana yg adem...
Rizqa Waril;2 tahun lalu;Positif;puncak ratu;Viewnya bagus banget, memang cocok seperti namanya puncak ratu. Tempatnya bersih, tiket masuknya murah cukup Rp.10.000 untuk dewasa. Anak-anak tidak dipungut biaya tambahan. …
Alesha;2 tahun lalu;Positif;puncak ratu;Tempat wisata yg asri dan sangat cocok untuk bersantai bersama keluarga, teman, dan atau pasangan
amalia wizaratul safina;2 tahun lalu;Positif;puncak ratu;Tempatnya bagus.. pas bgt view nya buat foto2.. tp ada slh satu tmp yg pengamanannya krg.. trus org yg jual minuman jg terbatas bgt pilihannya, next kalo mau k sini lg bs bw minum ato snack sndri..
Khoirul Anwar;2 tahun lalu;Positif?;puncak ratu;Keren tapi tak kasih bintang tiga karena fasilitas banyak yg g d perbaiki
Bang Ibe;2 tahun lalu;Positif;puncak ratu;View bagus bgt cocok buat santai bersama keluarga...
Rahman Ansory;2 tahun lalu;Positif;puncak ratu;Memiliki view bagus dan juga spot foto yang bagus, kekurangannya di akses jalan yang masih tidak ada papan petunjuk jalan menuju lokasi.
nounah legis;2 tahun lalu;Positif;puncak ratu;Keistimewaan @puncakratu ada di sore hari dn jg malam hari. Bisa menikmati senja dn melihat keindahan kota dri ketinggian
Ochi Vlog;2 tahun lalu;Positif;puncak ratu;Tempat ok, jalan menuju lokasi juga ok, hanya saja kurangnya fasilitas didalam.
Lisdia65 Diah;2 tahun lalu;Positif;puncak ratu;Tempat wisata pamekasan yang lagi hits, cukup bayar karcis 10.000 sudah bisa menikmati wisata ini.
Patrisa Kumalasari;2 tahun lalu;Positif;puncak ratu;Sudah banyak perubahan. Saran untuk toilet dan musholla di perbaiki lagi. Makasih ??
Mohammad Sholeh;2 tahun lalu;Positif;puncak ratu;Rekomended buat refreshing keluarga
Entoma 6500;2 tahun lalu;Positif;puncak ratu;Cocok buat berfoto kurang hiburan ya
aditya wicaksono;2 tahun lalu;Positif;puncak ratu;Lumayan menarik untuk ukuran destinasi di Pamekasan
Nanik Ekawati;2 tahun lalu;Positif;puncak ratu;Tempatnya bagus.. Adem banget.. Bikin betah..
PERSETAN FC TANAH MERAH BANGKALAN;2 tahun lalu;Positif;puncak ratu;Tempat yang bagus buat bersantai bareng teman2 dan keluarga dengan view pemandangan dr atas puncak bukit.. banyak spot foto yang tersedia...
avin channel;2 tahun lalu;Positif;puncak ratu;Untuk ke amanannya di tempat foto yg ada di tebing kurang sefty pagarnya kurang tinggi dan ada sebagian yg sudah patah sampahnya berserakan kebersihannya sgt kurang  tempatnya lumayan bagus
Sofiatun Imamah;2 tahun lalu;Positif;puncak ratu;Wisata yang cocok untuk anak-anak dan keluarga
Fadya Ihsan;2 tahun lalu;Positif;puncak ratu;Suka sekali tp d  tempat tempat extrim kurang memuaskan karna masih di bilang masih berbahaya untuk pengmbilan foto jembatanya agak bergoyang saran saya tp, maaf sebelumnya
Adim Alfarizi;2 tahun lalu;Positif;puncak ratu;"Bagus
Cuman kurang tempat makanan
Mkanannya cuman pop mie aj …"
Mohza Al;2 tahun lalu;Positif;puncak ratu;"Tolong di jaga kelestarianya
Sampahnya jangan dibuang sembarangan"
dimi ismanto;2 tahun lalu;Positif;puncak ratu;Tempatnya adem.. Perjalanan mudah dari arah pamekasan. Nyaman banget.. Banyak spot foto. Tempat tamasya favorit utk kluarga.
Ika bela;2 tahun lalu;Positif;puncak ratu;Is the best @puncak ratu.wisata paling menarik untuk liburan.cuaca yang amat segar.gc akan rugi deh klo kalian kesini?
Fahri Idrus;2 tahun lalu;Positif;puncak ratu;Tempat nya lumayan bagus
POP Ind TV;2 tahun lalu;Negatif;puncak ratu;Tempat pas' cuma masih ada sampahnya utk da erah pedesaan mending dimurahin dikit kek, terlalu mahal.
biker insyaf;2 tahun lalu;Positif;puncak ratu;View nya bagus klo sore hari,tp klo musim penghujan jalanx licin.so hati2 ya gaes
Ula Nur rahmatin;2 tahun lalu;Positif;puncak ratu;Tempatnya bagus buat liat sunset tapi tiket masuknya terlalu mahal 35k 1 orang
Syaifullah Sattari;2 tahun lalu;Positif;puncak ratu;Tepatnya yang sejuk dan nyamana lumayan indah pemandangannya hanya sedikit kurang bangus jalan akses masuknya dan penujuk arahnya kurang dari arah kota pamekasan
Dijah- rus;2 tahun lalu;Positif;puncak ratu;"Yah lumayan,
Hanya saja tempatnya terlalu jauh,
Pas nyampek tempat buat fotonya terlalu sedikit"
Lukman Alves;2 tahun lalu;Positif;puncak ratu;Viewnya Bagus buat santai dan menghilangkan penat.. byk spot foto
Eddy Copler;2 tahun lalu;Positif;puncak ratu;Bagus sejuk enak tapi sayang tidak ada petunjuk jalan nya menuju lokasi
Ufick Zabarela;2 tahun lalu;Positif;puncak ratu;Pemandangan alam yang sangat penting untuk selfie sama teman atau pacar dan apalagi suami istri...
Akun Bisnis;2 tahun lalu;Positif;puncak ratu;Di sana indah bagus. Cuman karcis masuknya udah agak mahal ?? …
Abd Kabar;2 tahun lalu;Negatif;puncak ratu;"Udah jauh2 ternyata tempatnya tutup
Tempat wisata di tutup cuman gara2 di boking orang
Tempat wisata Macam apa tu"
???? ?????;2 tahun lalu;Positif;puncak ratu;Pemandangan lumayan Menarik buat spot foto
Arif Wicaksono;2 tahun lalu;Positif;puncak ratu;lumayanlah
Ramli Roly;2 tahun lalu;Positif;puncak ratu;Sejuk bersih, toilet nanti ditambah ya...
Habibi Moza;2 tahun lalu;Positif;puncak ratu;Tempat rekreasi yg spekta sekali!
Hairul Madani;2 tahun lalu;Positif;puncak ratu;Tempat n view nya keren.???? …
Ani Bahtiar;2 tahun lalu;Positif;puncak ratu;Spotnya harus dikelola dg baik lagi
Murdi;2 tahun lalu;Positif;puncak ratu;Cocok buat piknik atau camping
Jeye 91;2 tahun lalu;Positif;puncak ratu;Indah alam ciptaan-Mu
Miya quen;2 tahun lalu;Positif;puncak ratu;Senang
jakie mahfud;2 tahun lalu;Positif;puncak ratu;Tempat nya recommended buat santai
Joko Kholiq;2 tahun lalu;Positif;puncak ratu;Bagus pemandangan nya
andi mulyono;2 tahun lalu;Positif;puncak ratu;Perlu update dan jaga kebersihanya
Ach Junaidi Junaidi;2 tahun lalu;Positif;puncak ratu;Panorama alam nya sangat indah
Zacky Rizand;2 tahun lalu;Positif;puncak ratu;Cocok untuk ngumpul dengan keluarga
syaiful abbas;2 tahun lalu;Positif;puncak ratu;Pemandangannya bagus...
Bolo Bolo;2 tahun lalu;Positif;puncak ratu;Bagus wisatanya
Daifil Amar Official;2 tahun lalu;Positif;puncak ratu;Sangat bagus
Husni Mubarok;2 tahun lalu;Positif;puncak ratu;Lumayan seru
ary Valent;2 tahun lalu;Positif;puncak ratu;Suka
F_ik R_amn;2 tahun lalu;Positif;puncak ratu;Lumayan
Raden Wijaya;2 tahun lalu;Positif;puncak ratu;Bagus
suwandi _;2 tahun lalu;Positif;puncak ratu;Lebur
al sya;2 tahun lalu;Positif;puncak ratu;Akan di kunjungi
IM ghazali;2 tahun lalu;Positif;puncak ratu;Mantap
Zainenda 1191;2 tahun lalu;Positif;puncak ratu;Mantap
Tutur P. Purbosayekti;2 tahun lalu;Positif;puncak ratu;Pemandangannya sangat bagus, sayang sepertinya kurang terawat, mungkin karena pandemi tentunya. Covid segera pergi
Edo Aditya;2 tahun lalu;Positif;puncak ratu;"ini adalah tempat yang sangat bagus untuk liburan bersama keluarga kami.
namun beberapa photoboots tidak dirawat dengan baik dan ""terlihat"" ber …"
Abd Rahem;2 tahun lalu;Positif;puncak ratu;Bagus, keren, cant …
Herlina S;2 tahun lalu;Positif;puncak ratu;Sangat sepi dan berdebu. Kurangnya toilet. Toilet yang tersedia berada di dekat pintu masuk. Jika Anda suka memotret, terutama dari ketinggian, inilah tempatnya. Tidak banyak yang bisa Anda lakukan  …
subairi;2 tahun lalu;Positif;puncak ratu;Keren n alami
bu'sobu' Channel;2 tahun lalu;Positif;puncak ratu;Keren dan canti …
Marlyn Syahimatus Zuhro;2 tahun lalu;Positif;puncak ratu;bersih dan keren....
Goes Ipoel;2 tahun lalu;Positif;puncak ratu;Tempatnya keren :)
taufiex jungle;2 tahun lalu;Positif;puncak ratu;Suasananya sejuk
Alim Muhaimin;2 tahun lalu;Positif;puncak ratu;Tempat yang bagus unt …
Mazro Almas;2 tahun lalu;Positif;puncak ratu;bukit yang ind …
husein alaydrus;2 tahun lalu;Positif;puncak ratu;Bagus
GBR05 FARM;2 tahun lalu;Positif;puncak ratu;mem …
Noval Arobi;2 tahun lalu;Positif;puncak ratu;Ppp
Wildan ArHa;2 tahun lalu;Positif;puncak ratu;Permata Tersembuny …
Abede Moein;2 tahun lalu;Positif;puncak ratu;Bagu …
Kandai Imam5;2 tahun lalu;Positif;puncak ratu;Ha …
050_Nifi Maulidya;3 bulan lalu;Positif;puncak ratu;Tempatnya bagusss banget udah berkali² kesini tapi ga bosen². Fasilitasnya lengkap mulai dari tempat parkir, kamar mandi, kantin, musholla, tempat istirahat dan spot foto menarik.
Vadia Bilqis;3 bulan lalu;Positif;puncak ratu;Indah..sering kesini pas malem..dan yaa byk yg udah diperbaiki dan mungkin lagi tahap perluasan,kemarin pas kesana tambah luas dan nambah kek rumah²an gitu,good bgt,moga makin maju utk kedepannya dan makin jadi sorotan warga²lainnya
faiza kara;3 bulan lalu;Positif;puncak ratu;Kamar mandinya bau jadi kurang nyaman untuk menggunakan fasilitas nya apalagi untuk camping. Pengamanan pada saat malam hari juga kurang sampai ada segerombolan ormas menghampiri.
ampriyanto 170365;3 bulan lalu;Positif;puncak ratu;Tempat yang nyaman santai romantis sejuk dan indah cocok utk keluarga group maupun rombongan..
zaini Art;3 bulan lalu;Positif;puncak ratu;Bukit dengan pemandangan indah, di tata dan dikelola dengan baik oleh desa Tebul Barat.
Rifqi Yasfa Official;3 bulan lalu;Positif;puncak ratu;Lumayan bagus
Muhally Ok;3 bulan lalu;Positif;puncak ratu;Keren dan canti …
As syakur Atuba;3 bulan lalu;Positif;puncak ratu;menyenangkan
MDR RALOVA MADURA;3 minggu lalu;Positif;puncak ratu;Bermanfaat bagi masyarakat Indonesia yang kehabisan bensin
Bustomi Menggugat;3 tahun lalu;Positif;puncak ratu;Keren. Suka pemandangannya. Asri. Bisa pesta durian juga. Udara segar. Pemandangan alam perdesaan cocok buat menghilangkan stress dan sarana liburan keluarga. Cuman sayangnya toiletnya ga ada airnya. Saran saya sarana kamar mandi dan toilet …
Nis Anisyah;3 tahun lalu;Positif;puncak ratu;Hawa nya sangat sejuk sekali. Sangat cocok untuk camping bareng keluarga atau sahabat. Pemandangan dari ketinggian yg menakjubkan membuat kita betah disini. Tiket masuk hanya 10k / orang kok. Untuk sampai ke tempat ini harus berjuang …
R. Triyanto Saputra;3 tahun lalu;Positif;puncak ratu;"SEKILAS PUNCAK RATU

Rekomended banget buat para traveler yang berwisata ke Madura utamanya …"
Agus Salim;3 tahun lalu;Positif;puncak ratu;"Cocok untuk bersantai bersama keluarga lokasi mudah dijangkau
Saran2
Untuk lebih mempercantik pandangan perlu adanya penambahan taman2 bunga dan yg utama perlu adanya bak sampah dilokasi korsi santai pengunjung"
Kholif Azzahroh;3 tahun lalu;Positif;puncak ratu;Tempatnya alami banget sahabat, di sini kita dapat menikmati pemandangan alam dari ketinggia. 11 12 lah sama paralayang, dan uniknya juga  banyak spot foto yang bernuansa instagramable. Di dalam juga tersedia caffe2 masa kini...  Mengenai tiket masuk hanya dengan 10 ribu rupiah kalian bisa menikmati semua dg bebas...
Moh Idris;3 tahun lalu;Positif;puncak ratu;Selamat datang di wisata Puncak Ratu Pamekasan ..... Tempatnya indah banget.... Apalagi saat langit berwarna biru dihiasi awan putih... Dan perbukitan yang indah nan rapi.....
Fani F;3 tahun lalu;Positif;puncak ratu;bisa lihat pemandangan sebagian kabupaten pamkesan dari dataran tinggi ini. lokasi masih dalam tahap pembangunan beberapa spot wisata.
atan harsa;3 tahun lalu;Positif;puncak ratu;Puncak Ratu terletak di daerah Tebul, kecamatan pegantenan, akses sangat mudah dari pusat kota pamekasan hanya membutuhkan waktu 30 menit dan sangat dianjurkan berangkat pagi hari saat kondisi agak sepi jadi kita bisa berswafoto dengan bebas. Tiket masuk ada 2, untuk tiket parkir kendaraan dan tiket perorangan saat memasuki lokasi.
Faisol Munif;3 tahun lalu;Positif;puncak ratu;Nyaman sekali tempatnya, spot untuk foto bagus banget...
Hairil Anwar;3 tahun lalu;Positif;puncak ratu;Lumayan untuk destinasi wisata alam, tempatnya cukup adem, mirip paralayang. Fasilitas masih kurang memadai.
Inayatul Maghfirah Agustania;3 tahun lalu;Positif;puncak ratu;Tempatnya bagus santai seperti di Malang mirip dengan di Malang hanya saja Spot fotonya masih sedikit jadi perlu ditambahkan lagi dan perlu ditingkatkan lagi agar bisa menarik lebih banyak pengunjung. Di sana juga tersedia Cafe sehingga …
Zaitul Harizah;3 tahun lalu;Positif;puncak ratu;"Tempatnya lumayan bagus, tinggal ditambah""i lagi dekorasinya biar tambah cantik"
Agus hendra wijaya;3 tahun lalu;Positif;puncak ratu;Sempet kesasar gegara tanda depan yg deket amal gak ada :D
Rizal Rakasiwi;3 tahun lalu;Positif;puncak ratu;Lumayan bagus hanya sampahnya bertebaran di tebing sama signal lemot untuk keamanan besi atau las nya kurang bagus pagar besi nya cuma 1
Nuril Fahmi;3 tahun lalu;Positif;puncak ratu;akses masyk lumayan bagus, biaya hemat dan cocok buat spot foto sembari menenangkan diri
Rofi Areiv;3 tahun lalu;Positif;puncak ratu;Tempatnya kurang berkesan, tidak begitu luas, dan petugas kebersihan tidak standby.
Rhonie Sapoetra;3 tahun lalu;Positif;puncak ratu;Wonderful of madura island...harap d tambah lagi keamanan na biar lbh safety buat anak2...
Syafaat Kodim;3 tahun lalu;Positif;puncak ratu;Lumayan bagus tempat wisatanya dan terhibur
Qoqo mahveen;3 tahun lalu;Positif;puncak ratu;Cukup menyenangkan,, kawasan curam banget
Kp-sodikin;3 tahun lalu;Positif;puncak ratu;Saya sangat suka sekali ketika mengunjungi wisata puncak ratu karena pemandangnya sangat indah
Icank 96;3 tahun lalu;Positif;puncak ratu;Pemandangannya begitu indah.. Dan tiketnya juga terjangkau
Siti Zubaidah;3 tahun lalu;Positif;puncak ratu;Nice.. pemandangan.a dapet
Adlsyah Yudha Perwira;3 tahun lalu;Positif;puncak ratu;Bagus masih bisa dikembangkan lagi, tetap patuhi protokol kesehatan
Silvia Agustin;3 tahun lalu;Positif;puncak ratu;Bagus viewnya cocok buat foto
Veraeka Diana;3 tahun lalu;Positif;puncak ratu;"Bagus tempatnya. Hanya saja jauh dari kota.
Fasilitas kamar mandi masih kurang layak.
Destinasi makanannya pun masih kurang, cuma ada 1 dan itupun makanan beratnya …"
taufiqur rahman;3 tahun lalu;Positif;puncak ratu;Semg semakin maju
Erika Honey;3 tahun lalu;Positif;puncak ratu;View nya baguusss bangeettt.... Suka...suka...
RANDOM DIR;3 tahun lalu;Positif;puncak ratu;Sudah mulai banyak yang berubah, banyak tambahan, tapi masih belum selesai.
Jannatul Ma'ala;3 tahun lalu;Positif;puncak ratu;Wisata hits versi Kota Pamekasan yang wajib di kunjungi nih freen ?? …
andri ariyanto;3 tahun lalu;Positif;puncak ratu;Serasa diluar Pamekasan padahal maseh di alam Pamekasan hebat
Putri Bali Mila Purnamasari;3 tahun lalu;Positif;puncak ratu;Recomended bgt buat liburan.. pemandangannya fresh banyak spot fotonya. Cocok buat liburan keluarga juga keren pokoknya?? …
Aina Salsabila Vardi Putri;3 tahun lalu;Positif;puncak ratu;Pemndangannya lumayan sihh.. Ijo semua, sarananya juga udah mendingan dari pada dulu, tinggal tambahin aja lahan buat spot foto yg bagus2.. ???? …
slamet budiono;3 tahun lalu;Positif;puncak ratu;Pemandangannya bagus. Gak nyangka di Madura ada pemandangan seperti ini. Cuma fasilitas kurang mungkin masih dalam  penyelesaian.
Irulz Channel;3 tahun lalu;Positif;puncak ratu;Tempat nya bagus n spot fotonya mantap, andaikan dibuat tempat paralayang seperti dimalang lebih mantap lagi.... ???? …
????? ?????? ?????;3 tahun lalu;Negatif;puncak ratu;Tiket masuk terlalu mahal. Masak setiap orang 10.000 Itupun fasilitasnya gak lengkap
adriansyah channel;3 tahun lalu;Positif;puncak ratu;Tempat wisata yg asyik, cocok buat refreshing bersama keluarga
Bella Rachma;3 tahun lalu;Positif;puncak ratu;Bagus, semacam kalibiru, sekarang sih Masih sepi mungkin karna belom viral
singgih andi;3 tahun lalu;Positif;puncak ratu;Sumpah bagusssssss pake banget
opek hunter;3 tahun lalu;Positif;puncak ratu;Nyaman, santai, sejuk pula
Moapi Kasrakas;3 tahun lalu;Negatif;puncak ratu;Lumayan sih. Tapi kurang bersih. Mungkin karena kurang tempat sampahnya.
abi oleolang;3 tahun lalu;Positif;puncak ratu;Serasa di Puncak Asmara
Arfp 08;3 tahun lalu;Positif;puncak ratu;Perlu pengelolaan lebih lanjut unt memperindah panorama alamnya
syarif fasira;3 tahun lalu;Positif;puncak ratu;Masih alami, natural dan bagus untuk diabadikan.
Ilham Ari Wahyudi;3 tahun lalu;Positif;puncak ratu;View nya bagus apalagi pa jam 5 sore
Firda Angelina;3 tahun lalu;Positif;puncak ratu;Toilet umumnya di perbagus lagi dan kasik tempat sampah
Nanang Arifin;3 tahun lalu;Positif;puncak ratu;Sangat indah pemandangan nya di tempat ini puncak ratu
Roby Aldyanto;3 tahun lalu;Positif;puncak ratu;Tiket masuk terlalu tak sebanding fasilitas yang masih minim
Duky Ami;3 tahun lalu;Positif;puncak ratu;Puncak terindah di kawasan Pamekasan Madura
NISYA NADHIF;3 tahun lalu;Positif;puncak ratu;Puncak ratu tak kalah bagusx sm tempat2 wisata di luar sana..???????? …
Lusiana M.A Official;3 tahun lalu;Positif;puncak ratu;Indah dan nyaman
Shofiea Rahmah;3 tahun lalu;Positif;puncak ratu;Viewny bgus..tingkatkan lagi yah pengin kesitu lagi suatu saat...
Oonk Stick;3 tahun lalu;Positif;puncak ratu;Tempatnya bagus adem.. dan masih alami
ar hakam;3 tahun lalu;Positif;puncak ratu;perlu ditingkatkan keamanan spot fotonya ..
Zainur Rohman;3 tahun lalu;Positif;puncak ratu;Tenang dan nyaman
Ahmad Fauzi Syamsi;3 tahun lalu;Positif;puncak ratu;Lumayan bagus tapi masih ada perehapan sebagian
faizatus shalamah;3 tahun lalu;Positif;puncak ratu;Penataan kurang maksimal
Nasiruddin El-hasani;3 tahun lalu;Positif;puncak ratu;Wisata baru yang butuh dana untuk terus dibangun
arif alam;3 tahun lalu;Positif;puncak ratu;Semakin keren, sayang malam nggak buka
Madura Society;3 tahun lalu;Positif;puncak ratu;Keren pemandangannya, sayangnya pelosok
bang tito;3 tahun lalu;Positif;puncak ratu;Viewnya buagus buanget.....
riyan baleho;3 tahun lalu;Positif;puncak ratu;Pemandangannya luar biasa.
Syifa sampang;3 tahun lalu;Positif;puncak ratu;Tidak ad tempat berteduh ketika hujan
FAHAT;3 tahun lalu;Positif;puncak ratu;Alami
I N.A;3 tahun lalu;Positif;puncak ratu;Indah tempatnya. Jalannya mulus.
Sefri;3 tahun lalu;Positif;puncak ratu;Kayaknya gaada yg lebih mending daripada ini di pamekasan
Ilham;3 tahun lalu;Positif;puncak ratu;Sangat memuaskan nuansa khas
Mufid Ardiansyah;3 tahun lalu;Positif;puncak ratu;Mantap
Samudera Pelangi;3 tahun lalu;Positif;puncak ratu;Masih kurang bagus
Mahfud Alfin;3 tahun lalu;Positif;puncak ratu;Duggen asli manis tampah pemanis gula
Acienk Barata;3 tahun lalu;Positif;puncak ratu;Pemandangannya bagus
teruslah bersholawat;3 tahun lalu;Positif;puncak ratu;Mantap lah adem
Iponk Syaiful;3 tahun lalu;Positif;puncak ratu;Pemandangannya bagus.
Vivin Karmilawati;3 tahun lalu;Positif;puncak ratu;lumayan bagus
Waridun Nafis;3 tahun lalu;Positif;puncak ratu;Uwwuw banget tempatnya
Iqbal Hilman;3 tahun lalu;Positif;puncak ratu;Masih dalam pengembangan
Indra Nur Cahyadi;3 tahun lalu;Positif;puncak ratu;Cukup bagus,
Fakhri Kirom;3 tahun lalu;Positif;puncak ratu;Mantap sekali
kamariyah ms;3 tahun lalu;Positif;puncak ratu;Lumayan recommended
Jack mr jack;3 tahun lalu;Positif;puncak ratu;is the best pokok nya
Kholid Yayan;3 tahun lalu;Positif;puncak ratu;Karena ini tempat ibadah
Habibi Rahman;3 tahun lalu;Positif;puncak ratu;Oke banget rekomendet
Waid Citos;3 tahun lalu;Positif;puncak ratu;Hari ini buka ya??
DHIAN PRAMUHADI;3 tahun lalu;Positif;puncak ratu;Istimewa, Pemadangan Bagus
Zakki Adhim;3 tahun lalu;Positif;puncak ratu;Indah mempesona
Fhia Princess;3 tahun lalu;Positif;puncak ratu;Indah Dan menakjubkan?? …
Bojes Farm;3 tahun lalu;Positif;puncak ratu;Menarik...
BUSADIN;3 tahun lalu;Positif;puncak ratu;?? ?? ?? ?? ?? …
Mazvil Channel;3 tahun lalu;Positif;puncak ratu;Lumayan bagus
Muhammad bin rachmad;3 tahun lalu;Positif;puncak ratu;asik
Donna Fasya;3 tahun lalu;Positif;puncak ratu;Bagusss
SAMMAN PRADA;3 tahun lalu;Positif;puncak ratu;Baik
Qurratul Aini;3 tahun lalu;Positif;puncak ratu;Baguuusss
aliya rachma;3 tahun lalu;Positif;puncak ratu;Bagusssss
Inunk Bebob;3 tahun lalu;Positif;puncak ratu;Tempatnya asri
Dwi Sari;3 tahun lalu;Positif;puncak ratu;Kayak di malang.  Pamekasan oke
Syaifulloh;3 tahun lalu;Positif;puncak ratu;bagus
Fitri Aditya;3 tahun lalu;Positif;puncak ratu;Bagus,
Arif Widodo Pratama (Ido);3 tahun lalu;Positif;puncak ratu;"Tempat yang bagus untuk dikunjungi jika Anda membutuhkan udara segar.
Letaknya tidak begitu jauh dari kota Pamekasan, dibutuhkan waktu sekitar 30 menit untuk sampai ke sana.
Waktu terbaik untuk berkunjung adalah sekitar pukul 07.00 h …"
Azraa Vaey;3 tahun lalu;Positif;puncak ratu;Sejuuuk ?? …
Dosen Bahasa Inggris;3 tahun lalu;Positif;puncak ratu;Belum selesai
Mohammad Nur Ramli;3 tahun lalu;Positif;puncak ratu;Tempat keren untuk mencari inspirasi.
Gatot Wiyono;3 tahun lalu;Positif;puncak ratu;Tempat yang ker …
akhmad fauzi;3 tahun lalu;Positif;puncak ratu;Siiip semoga menjadi kebanggaan Pamekasan.
Syaiful Bahri;3 tahun lalu;Positif;puncak ratu;Berada di pegunungan yang di …
OLEOLANG GROUP;3 tahun lalu;Positif;puncak ratu;KERRENNN POLL
Erha Agustina;3 tahun lalu;Positif;puncak ratu;Spot selfienya asyikk
Kmasjun Kmasjun (kmasjun);3 tahun lalu;Positif;puncak ratu;Semoga kamu masuk surga
edy sumantri;3 tahun lalu;Positif;puncak ratu;Sipp
Andi Kuadrat;3 tahun lalu;Positif;puncak ratu;Bagus sek …
achjalaludin;4 bulan lalu;Positif;puncak ratu;Bagi teman-teman yang suka camping di tempat yang tenang, nyaman dan segar, maka tempat ini sangat cocok sekali. Di sini teman-teman bisa melihat pemandangan nan hijau sejauh mata memandang di atas ketinggian (kurang lebih) 500 MDPL. Sebab …
Fauziah Rachmawati;4 bulan lalu;Positif;puncak ratu;"Tempat wisata yang menyatu dengan alam.
Fasilitas: parkir luas, kafe, tenda, warung..
Tiket masuk 10k parkir 3k.
Kalau malam spt paralayang di malang"
Zakiatul Maulidiyah;4 bulan lalu;Positif;puncak ratu;"Tempat wisata terbaik untuk camping bersama teman ataupun keluarga.
Vibes menyerupai kota batu Malang.
Tempat ini d Pamekasan, Madura, Jawa Timur."
Rofiatul Windariana;4 bulan lalu;Positif;puncak ratu;Bagus, bersih dan fasilitasnya lumayan banyak dan asyik buat samping
Erni Lusiana official;4 bulan lalu;Positif;puncak ratu;"Tempat adem nyaman, indah, dan menenangkan.
Karcis masuk murah"
